{
  "$schema": "http://json-schema.org/draft-07/schema#",
  "title": "Business Application Schema",
  "description": "Schema for defining business concepts and their relationships",
  "type": "object",
  "properties": {
    "$schema": {
      "type": "string",
      "description": "Path to the JSON schema"
    },
    "version": {
      "type": "string",
      "description": "Schema version",
      "pattern": "^\\d+\\.\\d+\\.\\d+$"
    },
    "name": {
      "type": "string",
      "description": "Application name"
    },
    "description": {
      "type": "string",
      "description": "Application description"
    },
    "versioning": {
      "type": "object",
      "description": "Record history configuration. When admin_role is set, that role can inspect the global _version audit resource.",
      "properties": {
        "admin_role": {
          "type": "string",
          "minLength": 1,
          "description": "Optional role allowed to inspect all version events from Operations > Versions."
        }
      },
      "additionalProperties": false,
      "default": {}
    },
    "concepts": {
      "type": "array",
      "description": "List of business concepts",
      "items": {
        "type": "object",
        "properties": {
          "name": {
            "type": "string",
            "description": "Concept name (snake_case recommended)"
          },
          "plural_name": {
            "type": "string",
            "description": "Plural name of the concept"
          },
          "description": {
            "type": "string",
            "description": "Description of the concept",
            "default": ""
          },
          "checks": {
            "type": "array",
            "description": "List of SQL check constraints",
            "items": { "type": "string" },
            "default": []
          },
          "data_size": {
            "type": "string",
            "description": "Expected data volume (s: <100, m: <10000, l: >10000)",
            "enum": ["s", "m", "l"],
            "default": "s"
          },
          "versioned": {
            "type": "boolean",
            "description": "Whether changes to this concept are recorded. Defaults to false. A non-recursive part_of concept inherits this value from its parent and must not declare it.",
            "default": false
          },
          "view": {
            "type": "object",
            "description": "Turns the concept into a read-only SQL view instead of a table: no table, no create/edit/delete UI, and write access is never granted (INSERT/UPDATE/DELETE are revoked from the API roles, since a simple view would otherwise be updatable). Everything else — list, filters, columns, search, export, row actions — is generated as for any other concept.",
            "additionalProperties": false,
            "required": ["query"],
            "properties": {
              "query": {
                "type": "string",
                "minLength": 1,
                "description": "SELECT returning one row per view record, wrapped by the generator into the view (concept names are the table names). It must return a 'concept' column with the name of the concept each row stands for, a 'concept_id' column with that record's id, and one column per declared field; both may be NULL together for aggregate rows that stand for no record. The generator adds 'id' (concept-concept_id, or the row's id_presentation when there is no record — it must never be null or empty) and 'id_presentation' (composed from id_presentation.fields), and clicking a row opens /<concept>/<concept_id> unless concept is null. The query runs with security_invoker, so every caller only sees the rows their row-level security already allows; a view over another view must be declared after it."
              }
            }
          },
          "id_presentation": {
            "type": "object",
            "properties": {
              "fields": {
                "type": "array",
                "items": { "type": "string" },
                "description": "Fields used to generate the presentation ID",
                "minItems": 1
              },
              "separator": {
                "type": "string",
                "description": "Separator used between fields in presentation ID",
                "default": " "
              },
              "show": {
                "type": "boolean",
                "description": "Whether to show the presentation ID in the UI",
                "default": false
              }
            },
            "required": ["fields"]
          },
          "documents": {
            "type": "object",
            "description": "Document management configuration for this concept",
            "properties": {
              "enabled": {
                "type": "boolean",
                "description": "Whether document management is active for this concept",
                "default": false
              },
              "versioned": {
                "type": "boolean",
                "description": "Whether documents support versioning",
                "default": false
              },
              "tags": {
                "type": "array",
                "description": "Allowed document tag values (enum)",
                "items": { "type": "string" },
                "minItems": 1
              }
            },
            "required": ["tags"],
            "additionalProperties": false
          },
          "actions": {
            "type": "array",
            "description": "Backend actions exposed as authenticated buttons in generated views.",
            "default": [],
            "items": {
              "type": "object",
              "additionalProperties": false,
              "properties": {
                "label": { "type": "string", "minLength": 1 },
                "source": {
                  "type": "string",
                  "pattern": "^[a-zA-Z0-9_][a-zA-Z0-9_.-]*\\.js$",
                  "description": "JavaScript file name located in backend/actions beside concepts.jsonc."
                },
                "placement": {
                  "type": "array", "minItems": 1, "uniqueItems": true,
                  "items": { "enum": ["list", "edit", "show"] }
                }
              },
              "required": ["label", "source", "placement"]
            }
          },
          "fields": {
            "type": "array",
            "items": {
              "type": "object",
              "properties": {
                "name": {
                  "type": "string",
                  "description": "Field name (snake_case recommended)"
                },
                "type": {
                  "type": "string",
                  "description": "Field type",
                  "enum": [
                    "string",
                    "markdown",
                    "integer",
                    "decimal",
                    "enum",
                    "boolean",
                    "date",
                    "datetime",
                    "json",
                    "relation_to_one",
                    "relation_to_many",
                    "prefill"
                  ]
                },
                "subtype": {
                  "type": "string",
                  "description": "Subtype for fields. 'part_of'/'related_to' for relations, 'money' for decimal, '<concept>.<plural_name>' for prefill."
                },
                "target": {
                  "type": "string",
                  "description": "Target concept name for relations"
                },
                "on_delete": {
                  "type": "string",
                  "description": "Deletion behavior for a relation_to_one. Defaults to 'cascade' when required is true and to 'set_null' when required is false. 'cascade' deletes referencing records; 'set_null' clears the foreign key and requires an optional relation; 'snapshot_data' first stores the referenced row as JSON in an internal _<field>_deleted_snapshot column and then clears the foreign key, so it also requires an optional relation.",
                  "enum": ["cascade", "set_null", "snapshot_data"]
                },
                "required": {
                  "enum": [true, false, "ask_after_login"],
                  "description": "Whether the field is required. Defaults to false, except for relation_to_one with subtype 'part_of' where it defaults to true.\n\n  'ask_after_login' is only allowed on plain (non-relation, non-calculated) fields of a profile concept (a concept referenced by security roles[].profile_concept). The column stays nullable in the database so the profile can be auto-created at login, but the UI treats the field as mandatory: forms validate it as required, and after login the application asks the user to fill any of these fields that are still empty. Once a value is set, a trigger prevents updating it back to null. The field must be writable by the profile's role.",
                  "default": false
                },
                "unique": {
                  "type": "boolean",
                  "description": "Whether the field must be unique",
                  "default": false
                },
                "default": {
                  "type": ["string", "number", "boolean", "null"],
                  "description": "Default value for the field. Supported forms:\n\n  Literal — the value is emitted as the SQL column DEFAULT.\n\n  from_metadata(key[, key...]) — only on string fields of a profile concept (a concept referenced by security roles[].profile_concept). When the profile row is auto-created at login, the field is filled with the first non-empty value among the given keys of the auth token's user_metadata; each key is looked up at the top level and inside the custom_claims object, where Supabase nests non-standard OIDC claims. Keys therefore cover both self-registration (signUp options.data, e.g. 'first_name') and SSO providers (e.g. Keycloak's 'given_name'). No SQL DEFAULT is emitted; when every key is empty the field is left null. E.g. 'from_metadata(first_name, given_name)'. The field must be writable by the profile's role and cannot be required (use 'ask_after_login' to collect missing values after login)."
                },
                "min_length": {
                  "type": "integer",
                  "description": "Minimum length for string fields",
                  "minimum": 0
                },
                "max_length": {
                  "type": "integer",
                  "description": "Maximum length for string fields",
                  "minimum": 1
                },
                "size": {
                  "type": "string",
                  "description": "Size of text field (s, m, l) - only applicable to string fields",
                  "enum": ["s", "m", "l"],
                  "default": "s"
                },
                "min": {
                  "type": "number",
                  "description": "Minimum value for numeric fields"
                },
                "max": {
                  "type": "number",
                  "description": "Maximum value for numeric fields"
                },
                "precision": {
                  "description": "Type-specific precision: total digits for decimal fields, or 'minute'/'second' display and input precision for datetime fields.",
                  "oneOf": [
                    {
                      "type": "integer",
                      "minimum": 1,
                      "maximum": 10
                    },
                    {
                      "type": "string",
                      "enum": ["minute", "second"]
                    }
                  ]
                },
                "scale": {
                  "type": "integer",
                  "description": "Scale for decimal fields",
                  "minimum": 0,
                  "maximum": 10
                },
                "enum_values": {
                  "type": "array",
                  "description": "Allowed values for enum fields",
                  "items": { "type": "string" }
                },
                "calculated": {
                  "type": "string",
                  "description": "Marks a field as backend-managed and read-only in the UI. Supported forms:\n\n  SQL expression — any PostgreSQL expression referencing sibling columns, e.g. 'quantity*unit_price'. Stored as a GENERATED ALWAYS AS column; cannot be written by the user.\n\n  rollup(func, child_concept, child_field) — aggregates child_field across all records of child_concept that are part_of this concept. func is one of: sum, count, avg, min, max. The result is kept in sync by triggers on the child table. E.g. 'rollup(sum,order_item,total_price)'.\n\n  copy(fk_field, source_field, when) — copies source_field from the concept referenced by fk_field. fk_field must be a relation_to_one field on the same concept. when controls when the copy fires and can be a single event or several joined with '+': 'on_change' (BEFORE INSERT OR UPDATE), 'on_insert' (BEFORE INSERT), 'on_change_in_state_<name>' (when the relevant concept changes while in that workflow state or reaches that workflow state). For state events on a concept without its own workflow the parent part_of concept's state is used: the value is copied both when a new row is inserted while the parent is already in that state, and when an existing parent transitions into that state. Changing fk_field while the parent is in a matching state also triggers a recopy. Direct writes to the field are blocked. E.g. 'copy(product,price,on_change_in_state_initial)' or 'copy(warehouse,cost,on_insert+on_change_in_state_confirmed)'.\n\n  copy_logged_on_insert(fk_field) — on INSERT sets fk_field to the id of the authenticated user's profile record for the concept that fk_field points to (which must be a profile concept). No-op when auth.uid() is NULL. Direct updates are blocked. E.g. 'copy_logged_on_insert(customer)'.\n\n  by_rules — value is written by a generated Supabase Edge Function that evaluates a trusted FEEL business rule. Direct user writes are blocked by trigger protection; service_role writes are allowed."
                },
                "description": {
                  "type": "string",
                  "description": "Description of the field",
                  "default": ""
                }
              },
              "required": ["name", "type"],
              "additionalProperties": false
            }
          }
        },
        "required": ["name", "fields", "id_presentation"],
        "additionalProperties": false
      }
    }
  },
  "required": ["version", "name", "concepts"],
  "additionalProperties": false
}
